title	act	scene	number	type	subtype	who	text
Coriolanus	2	3	1429	speech	verse	CITIZENS.ROMAN.5_Cor	Repent in their election.
Coriolanus	2	3	1429	speech	verse	CITIZENS.ROMAN.6_Cor	Repent in their election.
Coriolanus	2	3	1429	speech	verse	CITIZENS.ROMAN.7_Cor	Repent in their election.
Coriolanus	2	3	1429	speech	verse	CITIZENS.ROMAN.8_Cor	Repent in their election.
Coriolanus	2	3	1430	direction	exit	CITIZENS.ROMAN.1_Cor	Plebeians exit.
Coriolanus	2	3	1430	direction	exit	CITIZENS.ROMAN.2_Cor	Plebeians exit.
Coriolanus	2	3	1430	direction	exit	CITIZENS.ROMAN.3_Cor	Plebeians exit.
Coriolanus	2	3	1430	direction	exit	CITIZENS.ROMAN.4_Cor	Plebeians exit.
Coriolanus	2	3	1430	direction	exit	CITIZENS.ROMAN.5_Cor	Plebeians exit.
Coriolanus	2	3	1430	direction	exit	CITIZENS.ROMAN.6_Cor	Plebeians exit.
Coriolanus	2	3	1430	direction	exit	CITIZENS.ROMAN.7_Cor	Plebeians exit.
Coriolanus	2	3	1430	direction	exit	CITIZENS.ROMAN.8_Cor	Plebeians exit.
Coriolanus	2	3	1431	speech	verse	TRIBUNES.Brutus_Cor	Let them go on.
Coriolanus	2	3	1432	speech	verse	TRIBUNES.Brutus_Cor	This mutiny were better put in hazard
Coriolanus	2	3	1433	speech	verse	TRIBUNES.Brutus_Cor	Than stay, past doubt, for greater.
Coriolanus	2	3	1434	speech	verse	TRIBUNES.Brutus_Cor	If, as his nature is, he fall in rage
Coriolanus	2	3	1435	speech	verse	TRIBUNES.Brutus_Cor	With their refusal, both observe and answer
Coriolanus	2	3	1436	speech	verse	TRIBUNES.Brutus_Cor	The vantage of his anger.
Coriolanus	2	3	1437	speech	verse	TRIBUNES.Sicinius_Cor	To th’ Capitol, come.
Coriolanus	2	3	1438	speech	verse	TRIBUNES.Sicinius_Cor	We will be there before the stream o’ th’ people,
Coriolanus	2	3	1439	speech	verse	TRIBUNES.Sicinius_Cor	And this shall seem, as partly ’tis, their own,
Coriolanus	2	3	1440	speech	verse	TRIBUNES.Sicinius_Cor	Which we have goaded onward.
Coriolanus	2	3	1441	direction	exit	TRIBUNES.Brutus_Cor	They exit.
Coriolanus	2	3	1441	direction	exit	TRIBUNES.Sicinius_Cor	They exit.
Coriolanus	3	1	1442	direction	entrance	Coriolanus_Cor	Enter Coriolanus, Menenius, all the Gentry,Cominius, Titus Lartius, and other Senators.
Coriolanus	3	1	1442	direction	entrance	Menenius_Cor	Enter Coriolanus, Menenius, all the Gentry,Cominius, Titus Lartius, and other Senators.
Coriolanus	3	1	1442	direction	entrance	Cominius_Cor	Enter Coriolanus, Menenius, all the Gentry,Cominius, Titus Lartius, and other Senators.
Coriolanus	3	1	1442	direction	entrance	Lartius_Cor	Enter Coriolanus, Menenius, all the Gentry,Cominius, Titus Lartius, and other Senators.
Coriolanus	3	1	1442	direction	entrance	SENATORS.ROMAN_Cor	Enter Coriolanus, Menenius, all the Gentry,Cominius, Titus Lartius, and other Senators.
Coriolanus	3	1	1443	direction	sound		Cornets.
Coriolanus	3	1	1444	speech	verse	Coriolanus_Cor	Tullus Aufidius then had made new head?
Coriolanus	3	1	1445	speech	verse	Lartius_Cor	He had, my lord, and that it was which caused
Coriolanus	3	1	1446	speech	verse	Lartius_Cor	Our swifter composition.
Coriolanus	3	1	1447	speech	verse	Coriolanus_Cor	So then the Volsces stand but as at first,
Coriolanus	3	1	1448	speech	verse	Coriolanus_Cor	Ready, when time shall prompt them, to make road
Coriolanus	3	1	1449	speech	verse	Coriolanus_Cor	Upon ’s again.
Coriolanus	3	1	1450	speech	verse	Cominius_Cor	They are worn, lord consul, so,
Coriolanus	3	1	1451	speech	verse	Cominius_Cor	That we shall hardly in our ages see
Coriolanus	3	1	1452	speech	verse	Cominius_Cor	Their banners wave again.
Coriolanus	3	1	1453	speech	verse	Coriolanus_Cor	Saw you Aufidius?
Coriolanus	3	1	1454	speech	verse	Lartius_Cor	On safeguard he came to me, and did curse
Coriolanus	3	1	1455	speech	verse	Lartius_Cor	Against the Volsces, for they had so vilely
Coriolanus	3	1	1456	speech	verse	Lartius_Cor	Yielded the town. He is retired to Antium.
Coriolanus	3	1	1457	speech	verse	Coriolanus_Cor	Spoke he of me?
Coriolanus	3	1	1458	speech	verse	Lartius_Cor	He did, my lord.
Coriolanus	3	1	1459	speech	verse	Coriolanus_Cor	How? What?
Coriolanus	3	1	1460	speech	verse	Lartius_Cor	How often he had met you sword to sword;
Coriolanus	3	1	1461	speech	verse	Lartius_Cor	That of all things upon the earth he hated
Coriolanus	3	1	1462	speech	verse	Lartius_Cor	Your person most; that he would pawn his fortunes
Coriolanus	3	1	1463	speech	verse	Lartius_Cor	To hopeless restitution, so he might
Coriolanus	3	1	1464	speech	verse	Lartius_Cor	Be called your vanquisher.
Coriolanus	3	1	1465	speech	verse	Coriolanus_Cor	At Antium lives he?
Coriolanus	3	1	1466	speech	verse	Lartius_Cor	At Antium.
Coriolanus	3	1	1467	speech	verse	Coriolanus_Cor	I wish I had a cause to seek him there,
Coriolanus	3	1	1468	speech	verse	Coriolanus_Cor	To oppose his hatred fully. Welcome home.
Coriolanus	3	1	1469	direction	entrance	TRIBUNES.Sicinius_Cor	Enter Sicinius and Brutus.
Coriolanus	3	1	1469	direction	entrance	TRIBUNES.Brutus_Cor	Enter Sicinius and Brutus.
Coriolanus	3	1	1470	speech	verse	Coriolanus_Cor	Behold, these are the tribunes of the people,
Coriolanus	3	1	1471	speech	verse	Coriolanus_Cor	The tongues o’ th’ common mouth. I do despise them,
Coriolanus	3	1	1472	speech	verse	Coriolanus_Cor	For they do prank them in authority
Coriolanus	3	1	1473	speech	verse	Coriolanus_Cor	Against all noble sufferance.
Coriolanus	3	1	1474	speech	verse	TRIBUNES.Sicinius_Cor	Pass no further.
Coriolanus	3	1	1475	speech	verse	Coriolanus_Cor	Ha? What is that?
Coriolanus	3	1	1476	speech	verse	TRIBUNES.Brutus_Cor	It will be dangerous to go on. No further.
Coriolanus	3	1	1477	speech	verse	Coriolanus_Cor	What makes this change?
Coriolanus	3	1	1478	speech	verse	Menenius_Cor	The matter?
Coriolanus	3	1	1479	speech	verse	Cominius_Cor	Hath he not passed the noble and the common?
Coriolanus	3	1	1480	speech	verse	TRIBUNES.Brutus_Cor	Cominius, no.
Coriolanus	3	1	1481	speech	verse	Coriolanus_Cor	Have I had children’s voices?
Coriolanus	3	1	1482	speech	verse	SENATORS.ROMAN.0.1_Cor	Tribunes, give way. He shall to th’ marketplace.
Coriolanus	3	1	1483	speech	verse	TRIBUNES.Brutus_Cor	The people are incensed against him.
Coriolanus	3	1	1484	speech	verse	TRIBUNES.Sicinius_Cor	Stop,
Coriolanus	3	1	1485	speech	verse	TRIBUNES.Sicinius_Cor	Or all will fall in broil.
Coriolanus	3	1	1486	speech	verse	Coriolanus_Cor	Are these your herd?
Coriolanus	3	1	1487	speech	verse	Coriolanus_Cor	Must these have voices, that can yield them now
Coriolanus	3	1	1488	speech	verse	Coriolanus_Cor	And straight disclaim their tongues? What are your offices?
Coriolanus	3	1	1489	speech	verse	Coriolanus_Cor	You being their mouths, why rule you not their teeth?
Coriolanus	3	1	1490	speech	verse	Coriolanus_Cor	Have you not set them on?
Coriolanus	3	1	1491	speech	verse	Menenius_Cor	Be calm, be calm.
Coriolanus	3	1	1492	speech	verse	Coriolanus_Cor	It is a purposed thing, and grows by plot,
Coriolanus	3	1	1493	speech	verse	Coriolanus_Cor	To curb the will of the nobility.
Coriolanus	3	1	1494	speech	verse	Coriolanus_Cor	Suffer ’t, and live with such as cannot rule
Coriolanus	3	1	1495	speech	verse	Coriolanus_Cor	Nor ever will be ruled.
Coriolanus	3	1	1496	speech	verse	TRIBUNES.Brutus_Cor	Call ’t not a plot.
Coriolanus	3	1	1497	speech	verse	TRIBUNES.Brutus_Cor	The people cry you mocked them; and, of late,
Coriolanus	3	1	1498	speech	verse	TRIBUNES.Brutus_Cor	When corn was given them gratis, you repined,
Coriolanus	3	1	1499	speech	verse	TRIBUNES.Brutus_Cor	Scandaled the suppliants for the people, called them
Coriolanus	3	1	1500	speech	verse	TRIBUNES.Brutus_Cor	Timepleasers, flatterers, foes to nobleness.
Coriolanus	3	1	1501	speech	verse	Coriolanus_Cor	Why, this was known before.
Coriolanus	3	1	1502	speech	verse	TRIBUNES.Brutus_Cor	Not to them all.
Coriolanus	3	1	1503	speech	verse	Coriolanus_Cor	Have you informed them sithence?
Coriolanus	3	1	1504	speech	verse	TRIBUNES.Brutus_Cor	How? I inform them?
Coriolanus	3	1	1505	speech	verse	Cominius_Cor	You are like to do such business.
Coriolanus	3	1	1506	speech	verse	TRIBUNES.Brutus_Cor	Not unlike, each way, to better yours.
Coriolanus	3	1	1507	speech	verse	Coriolanus_Cor	Why then should I be consul? By yond clouds,
Coriolanus	3	1	1508	speech	verse	Coriolanus_Cor	Let me deserve so ill as you, and make me
Coriolanus	3	1	1509	speech	verse	Coriolanus_Cor	Your fellow tribune.
Coriolanus	3	1	1510	speech	verse	TRIBUNES.Sicinius_Cor	You show too much of that
Coriolanus	3	1	1511	speech	verse	TRIBUNES.Sicinius_Cor	For which the people stir. If you will pass
Coriolanus	3	1	1512	speech	verse	TRIBUNES.Sicinius_Cor	To where you are bound, you must inquire your way,
Coriolanus	3	1	1513	speech	verse	TRIBUNES.Sicinius_Cor	Which you are out of, with a gentler spirit,
Coriolanus	3	1	1514	speech	verse	TRIBUNES.Sicinius_Cor	Or never be so noble as a consul,
Coriolanus	3	1	1515	speech	verse	TRIBUNES.Sicinius_Cor	Nor yoke with him for tribune.
Coriolanus	3	1	1516	speech	verse	Menenius_Cor	Let’s be calm.
Coriolanus	3	1	1517	speech	verse	Cominius_Cor	The people are abused, set on. This palt’ring
Coriolanus	3	1	1518	speech	verse	Cominius_Cor	Becomes not Rome, nor has Coriolanus
Coriolanus	3	1	1519	speech	verse	Cominius_Cor	Deserved this so dishonored rub, laid falsely
Coriolanus	3	1	1520	speech	verse	Cominius_Cor	I’ th’ plain way of his merit.
Coriolanus	3	1	1521	speech	verse	Coriolanus_Cor	Tell me of corn?
Coriolanus	3	1	1522	speech	verse	Coriolanus_Cor	This was my speech, and I will speak ’t again.
Coriolanus	3	1	1523	speech	verse	Menenius_Cor	Not now, not now.
Coriolanus	3	1	1524	speech	verse	SENATORS.ROMAN.0.1_Cor	Not in this heat, sir, now.
Coriolanus	3	1	1525	speech	verse	Coriolanus_Cor	Now, as I live, I will.
Coriolanus	3	1	1526	speech	verse	Coriolanus_Cor	My nobler friends, I crave their pardons. For
Coriolanus	3	1	1527	speech	verse	Coriolanus_Cor	The mutable, rank-scented meiny, let them
Coriolanus	3	1	1528	speech	verse	Coriolanus_Cor	Regard me, as I do not flatter, and
Coriolanus	3	1	1529	speech	verse	Coriolanus_Cor	Therein behold themselves. I say again,
Coriolanus	3	1	1530	speech	verse	Coriolanus_Cor	In soothing them, we nourish ’gainst our senate
Coriolanus	3	1	1531	speech	verse	Coriolanus_Cor	The cockle of rebellion, insolence, sedition,
Coriolanus	3	1	1532	speech	verse	Coriolanus_Cor	Which we ourselves have plowed for, sowed, and scattered
Coriolanus	3	1	1533	speech	verse	Coriolanus_Cor	By mingling them with us, the honored number,
Coriolanus	3	1	1534	speech	verse	Coriolanus_Cor	Who lack not virtue, no, nor power, but that
Coriolanus	3	1	1535	speech	verse	Coriolanus_Cor	Which they have given to beggars.
Coriolanus	3	1	1536	speech	verse	Menenius_Cor	Well, no more.
Coriolanus	3	1	1537	speech	verse	SENATORS.ROMAN.0.1_Cor	No more words, we beseech you.
Coriolanus	3	1	1538	speech	verse	Coriolanus_Cor	How? No more?
Coriolanus	3	1	1539	speech	verse	Coriolanus_Cor	As for my country I have shed my blood,
Coriolanus	3	1	1540	speech	verse	Coriolanus_Cor	Not fearing outward force, so shall my lungs
Coriolanus	3	1	1541	speech	verse	Coriolanus_Cor	Coin words till their decay against those measles
Coriolanus	3	1	1542	speech	verse	Coriolanus_Cor	Which we disdain should tetter us, yet sought
Coriolanus	3	1	1543	speech	verse	Coriolanus_Cor	The very way to catch them.
Coriolanus	3	1	1544	speech	verse	TRIBUNES.Brutus_Cor	You speak o’ th’ people
Coriolanus	3	1	1545	speech	verse	TRIBUNES.Brutus_Cor	As if you were a god to punish, not
Coriolanus	3	1	1546	speech	verse	TRIBUNES.Brutus_Cor	A man of their infirmity.
Coriolanus	3	1	1547	speech	verse	TRIBUNES.Sicinius_Cor	’Twere well
Coriolanus	3	1	1548	speech	verse	TRIBUNES.Sicinius_Cor	We let the people know ’t.
Coriolanus	3	1	1549	speech	verse	Menenius_Cor	What, what? His choler?
Coriolanus	3	1	1550	speech	verse	Coriolanus_Cor	Choler?
Coriolanus	3	1	1551	speech	verse	Coriolanus_Cor	Were I as patient as the midnight sleep,
Coriolanus	3	1	1552	speech	verse	Coriolanus_Cor	By Jove, ’twould be my mind.
Coriolanus	3	1	1553	speech	verse	TRIBUNES.Sicinius_Cor	It is a mind
Coriolanus	3	1	1554	speech	verse	TRIBUNES.Sicinius_Cor	That shall remain a poison where it is,
Coriolanus	3	1	1555	speech	verse	TRIBUNES.Sicinius_Cor	Not poison any further.
Coriolanus	3	1	1556	speech	verse	Coriolanus_Cor	“Shall remain”?
Coriolanus	3	1	1557	speech	verse	Coriolanus_Cor	Hear you this Triton of the minnows? Mark you
Coriolanus	3	1	1558	speech	verse	Coriolanus_Cor	His absolute “shall”?
Coriolanus	3	1	1559	speech	verse	Cominius_Cor	’Twas from the canon.
Coriolanus	3	1	1560	speech	verse	Coriolanus_Cor	“Shall”?
Coriolanus	3	1	1561	speech	verse	Coriolanus_Cor	O good but most unwise patricians, why,
Coriolanus	3	1	1562	speech	verse	Coriolanus_Cor	You grave but reckless senators, have you thus
Coriolanus	3	1	1563	speech	verse	Coriolanus_Cor	Given Hydra here to choose an officer,
Coriolanus	3	1	1564	speech	verse	Coriolanus_Cor	That with his peremptory “shall,” being but
Coriolanus	3	1	1565	speech	verse	Coriolanus_Cor	The horn and noise o’ th’ monster’s, wants not spirit
Coriolanus	3	1	1566	speech	verse	Coriolanus_Cor	To say he’ll turn your current in a ditch
Coriolanus	3	1	1567	speech	verse	Coriolanus_Cor	And make your channel his? If he have power,
Coriolanus	3	1	1568	speech	verse	Coriolanus_Cor	Then vail your ignorance; if none, awake
Coriolanus	3	1	1569	speech	verse	Coriolanus_Cor	Your dangerous lenity. If you are learned,
Coriolanus	3	1	1570	speech	verse	Coriolanus_Cor	Be not as common fools; if you are not,
Coriolanus	3	1	1571	speech	verse	Coriolanus_Cor	Let them have cushions by you. You are plebeians,
Coriolanus	3	1	1572	speech	verse	Coriolanus_Cor	If they be senators; and they are no less
Coriolanus	3	1	1573	speech	verse	Coriolanus_Cor	When, both your voices blended, the great’st taste
Coriolanus	3	1	1574	speech	verse	Coriolanus_Cor	Most palates theirs. They choose their magistrate,
Coriolanus	3	1	1575	speech	verse	Coriolanus_Cor	And such a one as he, who puts his “shall,”
Coriolanus	3	1	1576	speech	verse	Coriolanus_Cor	His popular “shall,” against a graver bench
Coriolanus	3	1	1577	speech	verse	Coriolanus_Cor	Than ever frowned in Greece. By Jove himself,
Coriolanus	3	1	1578	speech	verse	Coriolanus_Cor	It makes the consuls base! And my soul aches
Coriolanus	3	1	1579	speech	verse	Coriolanus_Cor	To know, when two authorities are up,
Coriolanus	3	1	1580	speech	verse	Coriolanus_Cor	Neither supreme, how soon confusion
Coriolanus	3	1	1581	speech	verse	Coriolanus_Cor	May enter ’twixt the gap of both and take
Coriolanus	3	1	1582	speech	verse	Coriolanus_Cor	The one by th’ other.
Coriolanus	3	1	1583	speech	verse	Cominius_Cor	Well, on to th’ marketplace.
Coriolanus	3	1	1584	speech	verse	Coriolanus_Cor	Whoever gave that counsel to give forth
Coriolanus	3	1	1585	speech	verse	Coriolanus_Cor	The corn o’ th’ storehouse gratis, as ’twas used
Coriolanus	3	1	1586	speech	verse	Coriolanus_Cor	Sometime in Greece—
Coriolanus	3	1	1587	speech	verse	Menenius_Cor	Well, well, no more of that.
Coriolanus	3	1	1588	speech	verse	Coriolanus_Cor	Though there the people had more absolute power,
Coriolanus	3	1	1589	speech	verse	Coriolanus_Cor	I say they nourished disobedience, fed
Coriolanus	3	1	1590	speech	verse	Coriolanus_Cor	The ruin of the state.
Coriolanus	3	1	1591	speech	verse	TRIBUNES.Brutus_Cor	Why shall the people give
Coriolanus	3	1	1592	speech	verse	TRIBUNES.Brutus_Cor	One that speaks thus their voice?
Coriolanus	3	1	1593	speech	verse	Coriolanus_Cor	I’ll give my reasons,
Coriolanus	3	1	1594	speech	verse	Coriolanus_Cor	More worthier than their voices. They know the corn
Coriolanus	3	1	1595	speech	verse	Coriolanus_Cor	Was not our recompense, resting well assured
Coriolanus	3	1	1596	speech	verse	Coriolanus_Cor	They ne’er did service for ’t. Being pressed to th’ war,
Coriolanus	3	1	1597	speech	verse	Coriolanus_Cor	Even when the navel of the state was touched,
Coriolanus	3	1	1598	speech	verse	Coriolanus_Cor	They would not thread the gates. This kind of service
Coriolanus	3	1	1599	speech	verse	Coriolanus_Cor	Did not deserve corn gratis. Being i’ th’ war,
Coriolanus	3	1	1600	speech	verse	Coriolanus_Cor	Their mutinies and revolts, wherein they showed
Coriolanus	3	1	1601	speech	verse	Coriolanus_Cor	Most valor, spoke not for them. Th’ accusation
Coriolanus	3	1	1602	speech	verse	Coriolanus_Cor	Which they have often made against the Senate,
Coriolanus	3	1	1603	speech	verse	Coriolanus_Cor	All cause unborn, could never be the native
Coriolanus	3	1	1604	speech	verse	Coriolanus_Cor	Of our so frank donation. Well, what then?
Coriolanus	3	1	1605	speech	verse	Coriolanus_Cor	How shall this bosom multiplied digest
Coriolanus	3	1	1606	speech	verse	Coriolanus_Cor	The Senate’s courtesy? Let deeds express
Coriolanus	3	1	1607	speech	verse	Coriolanus_Cor	What’s like to be their words: “We did request it;
Coriolanus	3	1	1608	speech	verse	Coriolanus_Cor	We are the greater poll, and in true fear
Coriolanus	3	1	1609	speech	verse	Coriolanus_Cor	They gave us our demands.” Thus we debase
Coriolanus	3	1	1610	speech	verse	Coriolanus_Cor	The nature of our seats and make the rabble
Coriolanus	3	1	1611	speech	verse	Coriolanus_Cor	Call our cares fears, which will in time
Coriolanus	3	1	1612	speech	verse	Coriolanus_Cor	Break ope the locks o’ th’ Senate and bring in
Coriolanus	3	1	1613	speech	verse	Coriolanus_Cor	The crows to peck the eagles.
Coriolanus	3	1	1614	speech	verse	Menenius_Cor	Come, enough.
Coriolanus	3	1	1615	speech	verse	TRIBUNES.Brutus_Cor	Enough, with over-measure.
Coriolanus	3	1	1616	speech	verse	Coriolanus_Cor	No, take more!
Coriolanus	3	1	1617	speech	verse	Coriolanus_Cor	What may be sworn by, both divine and human,
Coriolanus	3	1	1618	speech	verse	Coriolanus_Cor	Seal what I end withal! This double worship—
Coriolanus	3	1	1619	speech	verse	Coriolanus_Cor	Where one part does disdain with cause, the other
Coriolanus	3	1	1620	speech	verse	Coriolanus_Cor	Insult without all reason, where gentry, title, wisdom
Coriolanus	3	1	1621	speech	verse	Coriolanus_Cor	Cannot conclude but by the yea and no
Coriolanus	3	1	1622	speech	verse	Coriolanus_Cor	Of general ignorance—it must omit
Coriolanus	3	1	1623	speech	verse	Coriolanus_Cor	Real necessities and give way the while
Coriolanus	3	1	1624	speech	verse	Coriolanus_Cor	To unstable slightness. Purpose so barred, it follows
Coriolanus	3	1	1625	speech	verse	Coriolanus_Cor	Nothing is done to purpose. Therefore, beseech you—
Coriolanus	3	1	1626	speech	verse	Coriolanus_Cor	You that will be less fearful than discreet,
Coriolanus	3	1	1627	speech	verse	Coriolanus_Cor	That love the fundamental part of state
Coriolanus	3	1	1628	speech	verse	Coriolanus_Cor	More than you doubt the change on ’t, that prefer
Coriolanus	3	1	1629	speech	verse	Coriolanus_Cor	A noble life before a long, and wish
Coriolanus	3	1	1630	speech	verse	Coriolanus_Cor	To jump a body with a dangerous physic
Coriolanus	3	1	1631	speech	verse	Coriolanus_Cor	That’s sure of death without it—at once pluck out
Coriolanus	3	1	1632	speech	verse	Coriolanus_Cor	The multitudinous tongue; let them not lick
Coriolanus	3	1	1633	speech	verse	Coriolanus_Cor	The sweet which is their poison. Your dishonor
Coriolanus	3	1	1634	speech	verse	Coriolanus_Cor	Mangles true judgment and bereaves the state
Coriolanus	3	1	1635	speech	verse	Coriolanus_Cor	Of that integrity which should become ’t,
Coriolanus	3	1	1636	speech	verse	Coriolanus_Cor	Not having the power to do the good it would
Coriolanus	3	1	1637	speech	verse	Coriolanus_Cor	For th’ ill which doth control ’t.
Coriolanus	3	1	1638	speech	verse	TRIBUNES.Brutus_Cor	’Has said enough.
Coriolanus	3	1	1639	speech	verse	TRIBUNES.Sicinius_Cor	’Has spoken like a traitor and shall answer
Coriolanus	3	1	1640	speech	verse	TRIBUNES.Sicinius_Cor	As traitors do.
Coriolanus	3	1	1641	speech	verse	Coriolanus_Cor	Thou wretch, despite o’erwhelm thee!
Coriolanus	3	1	1642	speech	verse	Coriolanus_Cor	What should the people do with these bald tribunes,
Coriolanus	3	1	1643	speech	verse	Coriolanus_Cor	On whom depending, their obedience fails
Coriolanus	3	1	1644	speech	verse	Coriolanus_Cor	To th’ greater bench? In a rebellion,
Coriolanus	3	1	1645	speech	verse	Coriolanus_Cor	When what’s not meet but what must be was law,
Coriolanus	3	1	1646	speech	verse	Coriolanus_Cor	Then were they chosen. In a better hour,
Coriolanus	3	1	1647	speech	verse	Coriolanus_Cor	Let what is meet be said it must be meet,
Coriolanus	3	1	1648	speech	verse	Coriolanus_Cor	And throw their power i’ th’ dust.
Coriolanus	3	1	1649	speech	verse	TRIBUNES.Brutus_Cor	Manifest treason.
Coriolanus	3	1	1650	speech	verse	TRIBUNES.Sicinius_Cor	This a consul? No.
Coriolanus	3	1	1651	speech	verse	TRIBUNES.Brutus_Cor	The aediles, ho! Let him be apprehended.
Coriolanus	3	1	1652	direction	entrance	AEDILES.X.1_Cor	Enter an Aedile.
Coriolanus	3	1	1653	speech	verse	TRIBUNES.Sicinius_Cor	Go, call the people; in whose name myself
Coriolanus	3	1	1654	direction	exit	AEDILES.X.1_Cor	Aedile exits.
Coriolanus	3	1	1655	speech	verse	TRIBUNES.Sicinius_Cor	Attach thee as a traitorous innovator,
Coriolanus	3	1	1656	speech	verse	TRIBUNES.Sicinius_Cor	A foe to th’ public weal. Obey, I charge thee,
Coriolanus	3	1	1657	speech	verse	TRIBUNES.Sicinius_Cor	And follow to thine answer.
Coriolanus	3	1	1658	speech	verse	Coriolanus_Cor	Hence, old goat.
Coriolanus	3	1	1659	speech	verse	SENATORS.ROMAN_Cor	We’ll surety him.
Coriolanus	3	1	1660	direction	delivery	Cominius_Cor	, to Sicinius
Coriolanus	3	1	1661	speech	verse	Cominius_Cor	Agèd sir, hands off.
Coriolanus	3	1	1662	direction	delivery	Coriolanus_Cor	, to Sicinius
Coriolanus	3	1	1663	speech	verse	Coriolanus_Cor	Hence, rotten thing, or I shall shake thy bones
Coriolanus	3	1	1664	speech	verse	Coriolanus_Cor	Out of thy garments.
Coriolanus	3	1	1665	speech	verse	TRIBUNES.Sicinius_Cor	Help, you citizens!
Coriolanus	3	1	1666	direction	entrance	CITIZENS.ROMAN_Cor	Enter a rabble of Plebeians with the Aediles.
Coriolanus	3	1	1666	direction	entrance	AEDILES_Cor	Enter a rabble of Plebeians with the Aediles.
Coriolanus	3	1	1667	speech	verse	Menenius_Cor	On both sides more respect!
Coriolanus	3	1	1668	speech	verse	TRIBUNES.Sicinius_Cor	Here’s he that would take from you all your power.
Coriolanus	3	1	1669	speech	verse	TRIBUNES.Brutus_Cor	Seize him, aediles.
Coriolanus	3	1	1670	speech	verse	CITIZENS.ROMAN_Cor	Down with him, down with him!
Coriolanus	3	1	1671	speech	verse	SENATORS.ROMAN.0.2_Cor	Weapons, weapons, weapons!
Coriolanus	3	1	1672	direction	business	CITIZENS.ROMAN_Cor	They all bustle about Coriolanus.
Coriolanus	3	1	1672	direction	business	AEDILES_Cor	They all bustle about Coriolanus.
Coriolanus	3	1	1673	speech	verse	SENATORS.ROMAN.0.2_Cor	Tribunes, patricians, citizens, what ho!
Coriolanus	3	1	1674	speech	verse	SENATORS.ROMAN.0.2_Cor	Sicinius, Brutus, Coriolanus, citizens!
Coriolanus	3	1	1675	speech	verse	SENATORS.ROMAN_Cor	Peace, peace, peace! Stay, hold, peace!
Coriolanus	3	1	1675	speech	verse	TRIBUNES.Sicinius_Cor	Peace, peace, peace! Stay, hold, peace!
Coriolanus	3	1	1675	speech	verse	TRIBUNES.Brutus_Cor	Peace, peace, peace! Stay, hold, peace!
Coriolanus	3	1	1675	speech	verse	Menenius_Cor	Peace, peace, peace! Stay, hold, peace!
Coriolanus	3	1	1675	speech	verse	Cominius_Cor	Peace, peace, peace! Stay, hold, peace!
Coriolanus	3	1	1675	speech	verse	Lartius_Cor	Peace, peace, peace! Stay, hold, peace!
Coriolanus	3	1	1676	speech	verse	Menenius_Cor	What is about to be? I am out of breath.
Coriolanus	3	1	1677	speech	verse	Menenius_Cor	Confusion’s near. I cannot speak. You, tribunes
Coriolanus	3	1	1678	speech	verse	Menenius_Cor	To th’ people!—Coriolanus, patience!—
Coriolanus	3	1	1679	speech	verse	Menenius_Cor	Speak, good Sicinius.
Coriolanus	3	1	1680	speech	verse	TRIBUNES.Sicinius_Cor	Hear me, people! Peace!
Coriolanus	3	1	1681	speech	verse	CITIZENS.ROMAN_Cor	Let’s hear our tribune. Peace! Speak, speak, speak.
Coriolanus	3	1	1682	speech	verse	TRIBUNES.Sicinius_Cor	You are at point to lose your liberties.
Coriolanus	3	1	1683	speech	verse	TRIBUNES.Sicinius_Cor	Martius would have all from you, Martius,
Coriolanus	3	1	1684	speech	verse	TRIBUNES.Sicinius_Cor	Whom late you have named for consul.
Coriolanus	3	1	1685	speech	verse	Menenius_Cor	Fie, fie, fie!
Coriolanus	3	1	1686	speech	verse	Menenius_Cor	This is the way to kindle, not to quench.
Coriolanus	3	1	1687	speech	verse	SENATORS.ROMAN.0.1_Cor	To unbuild the city and to lay all flat.
Coriolanus	3	1	1688	speech	verse	TRIBUNES.Sicinius_Cor	What is the city but the people?
Coriolanus	3	1	1689	speech	verse	CITIZENS.ROMAN_Cor	True,
Coriolanus	3	1	1690	speech	verse	CITIZENS.ROMAN_Cor	The people are the city.
Coriolanus	3	1	1691	speech	verse	TRIBUNES.Brutus_Cor	By the consent of all, we were established
Coriolanus	3	1	1692	speech	verse	TRIBUNES.Brutus_Cor	The people’s magistrates.
Coriolanus	3	1	1693	speech	verse	CITIZENS.ROMAN_Cor	You so remain.
Coriolanus	3	1	1694	speech	verse	Menenius_Cor	And so are like to do.
Coriolanus	3	1	1695	speech	verse	Coriolanus_Cor	That is the way to lay the city flat,
Coriolanus	3	1	1696	speech	verse	Coriolanus_Cor	To bring the roof to the foundation
Coriolanus	3	1	1697	speech	verse	Coriolanus_Cor	And bury all which yet distinctly ranges
Coriolanus	3	1	1698	speech	verse	Coriolanus_Cor	In heaps and piles of ruin.
Coriolanus	3	1	1699	speech	verse	TRIBUNES.Sicinius_Cor	This deserves death.
Coriolanus	3	1	1700	speech	verse	TRIBUNES.Brutus_Cor	Or let us stand to our authority
Coriolanus	3	1	1701	speech	verse	TRIBUNES.Brutus_Cor	Or let us lose it. We do here pronounce,
Coriolanus	3	1	1702	speech	verse	TRIBUNES.Brutus_Cor	Upon the part o’ th’ people, in whose power
Coriolanus	3	1	1703	speech	verse	TRIBUNES.Brutus_Cor	We were elected theirs, Martius is worthy
