title	act	scene	number	type	subtype	who	text
The Tempest	2	2	1142	speech	prose	Trinculo_Tmp	—but that the poor monster’s in drink. An abominable monster.
The Tempest	2	2	1143	speech	verse	Caliban_Tmp	I’ll show thee the best springs. I’ll pluck thee berries.
The Tempest	2	2	1144	speech	verse	Caliban_Tmp	I’ll fish for thee and get thee wood enough.
The Tempest	2	2	1145	speech	verse	Caliban_Tmp	A plague upon the tyrant that I serve.
The Tempest	2	2	1146	speech	verse	Caliban_Tmp	I’ll bear him no more sticks, but follow thee,
The Tempest	2	2	1147	speech	verse	Caliban_Tmp	Thou wondrous man.
The Tempest	2	2	1148	speech	prose	Trinculo_Tmp	A most ridiculous monster, to make a wonder of a poor drunkard.
The Tempest	2	2	1149	direction	business	Caliban_Tmp	, standing
The Tempest	2	2	1150	speech	verse	Caliban_Tmp	I prithee, let me bring thee where crabs grow,
The Tempest	2	2	1151	speech	verse	Caliban_Tmp	And I with my long nails will dig thee pignuts,
The Tempest	2	2	1152	speech	verse	Caliban_Tmp	Show thee a jay’s nest, and instruct thee how
The Tempest	2	2	1153	speech	verse	Caliban_Tmp	To snare the nimble marmoset. I’ll bring thee
The Tempest	2	2	1154	speech	verse	Caliban_Tmp	To clustering filberts, and sometimes I’ll get thee
The Tempest	2	2	1155	speech	verse	Caliban_Tmp	Young scamels from the rock. Wilt thou go with me?
The Tempest	2	2	1156	speech	prose	Stephano_Tmp	I prithee now, lead the way without any more talking.—Trinculo, the King and all our company else being drowned, we will inherit here. —Here, bear my bottle.—Fellow Trinculo, we’ll fill him by and by again.
The Tempest	2	2	1157	direction	delivery	Caliban_Tmp	sings drunkenly
The Tempest	2	2	1158	speech	verse	Caliban_Tmp	Farewell, master, farewell, farewell.
The Tempest	2	2	1159	speech	prose	Trinculo_Tmp	A howling monster, a drunken monster.
The Tempest	2	2	1160	direction	delivery	Caliban_Tmp	sings
The Tempest	2	2	1161	speech	verse	Caliban_Tmp	No more dams I’ll make for fish,
The Tempest	2	2	1162	speech	verse	Caliban_Tmp	Nor fetch in firing
The Tempest	2	2	1163	speech	verse	Caliban_Tmp	At requiring,
The Tempest	2	2	1164	speech	verse	Caliban_Tmp	Nor scrape trenchering, nor wash dish.
The Tempest	2	2	1165	speech	verse	Caliban_Tmp	’Ban, ’ban, Ca-caliban
The Tempest	2	2	1166	speech	verse	Caliban_Tmp	Has a new master. Get a new man.
The Tempest	2	2	1167	speech	prose	Caliban_Tmp	Freedom, high-day! High-day, freedom! Freedom, high-day, freedom!
The Tempest	2	2	1168	speech	prose	Stephano_Tmp	O brave monster! Lead the way.
The Tempest	2	2	1169	direction	exit	Caliban_Tmp	They exit.
The Tempest	2	2	1169	direction	exit	Stephano_Tmp	They exit.
The Tempest	2	2	1169	direction	exit	Trinculo_Tmp	They exit.
The Tempest	3	1	1170	direction	entrance	Ferdinand_Tmp	Enter Ferdinand bearing a log.
The Tempest	3	1	1171	speech	verse	Ferdinand_Tmp	There be some sports are painful, and their labor
The Tempest	3	1	1172	speech	verse	Ferdinand_Tmp	Delight in them sets off; some kinds of baseness
The Tempest	3	1	1173	speech	verse	Ferdinand_Tmp	Are nobly undergone; and most poor matters
The Tempest	3	1	1174	speech	verse	Ferdinand_Tmp	Point to rich ends. This my mean task
The Tempest	3	1	1175	speech	verse	Ferdinand_Tmp	Would be as heavy to me as odious, but
The Tempest	3	1	1176	speech	verse	Ferdinand_Tmp	The mistress which I serve quickens what’s dead
The Tempest	3	1	1177	speech	verse	Ferdinand_Tmp	And makes my labors pleasures. O, she is
The Tempest	3	1	1178	speech	verse	Ferdinand_Tmp	Ten times more gentle than her father’s crabbed,
The Tempest	3	1	1179	speech	verse	Ferdinand_Tmp	And he’s composed of harshness. I must remove
The Tempest	3	1	1180	speech	verse	Ferdinand_Tmp	Some thousands of these logs and pile them up,
The Tempest	3	1	1181	speech	verse	Ferdinand_Tmp	Upon a sore injunction. My sweet mistress
The Tempest	3	1	1182	speech	verse	Ferdinand_Tmp	Weeps when she sees me work, and says such baseness
The Tempest	3	1	1183	speech	verse	Ferdinand_Tmp	Had never like executor. I forget;
The Tempest	3	1	1184	speech	verse	Ferdinand_Tmp	But these sweet thoughts do even refresh my labors,
The Tempest	3	1	1185	speech	verse	Ferdinand_Tmp	Most busiest when I do it.
The Tempest	3	1	1186	direction	entrance	Miranda_Tmp	Enter Miranda; and Prospero at a distance, unobserved.
The Tempest	3	1	1186	direction	entrance	Prospero_Tmp	Enter Miranda; and Prospero at a distance, unobserved.
The Tempest	3	1	1187	speech	verse	Miranda_Tmp	Alas now, pray you,
The Tempest	3	1	1188	speech	verse	Miranda_Tmp	Work not so hard. I would the lightning had
The Tempest	3	1	1189	speech	verse	Miranda_Tmp	Burnt up those logs that you are enjoined to pile.
The Tempest	3	1	1190	speech	verse	Miranda_Tmp	Pray, set it down and rest you. When this burns
The Tempest	3	1	1191	speech	verse	Miranda_Tmp	’Twill weep for having wearied you. My father
The Tempest	3	1	1192	speech	verse	Miranda_Tmp	Is hard at study. Pray now, rest yourself.
The Tempest	3	1	1193	speech	verse	Miranda_Tmp	He’s safe for these three hours.
The Tempest	3	1	1194	speech	verse	Ferdinand_Tmp	O most dear mistress,
The Tempest	3	1	1195	speech	verse	Ferdinand_Tmp	The sun will set before I shall discharge
The Tempest	3	1	1196	speech	verse	Ferdinand_Tmp	What I must strive to do.
The Tempest	3	1	1197	speech	verse	Miranda_Tmp	If you’ll sit down,
The Tempest	3	1	1198	speech	verse	Miranda_Tmp	I’ll bear your logs the while. Pray, give me that.
The Tempest	3	1	1199	speech	verse	Miranda_Tmp	I’ll carry it to the pile.
The Tempest	3	1	1200	speech	verse	Ferdinand_Tmp	No, precious creature,
The Tempest	3	1	1201	speech	verse	Ferdinand_Tmp	I had rather crack my sinews, break my back,
The Tempest	3	1	1202	speech	verse	Ferdinand_Tmp	Than you should such dishonor undergo
The Tempest	3	1	1203	speech	verse	Ferdinand_Tmp	While I sit lazy by.
The Tempest	3	1	1204	speech	verse	Miranda_Tmp	It would become me
The Tempest	3	1	1205	speech	verse	Miranda_Tmp	As well as it does you, and I should do it
The Tempest	3	1	1206	speech	verse	Miranda_Tmp	With much more ease, for my good will is to it,
The Tempest	3	1	1207	speech	verse	Miranda_Tmp	And yours it is against.
The Tempest	3	1	1208	direction	delivery	Prospero_Tmp	, aside
The Tempest	3	1	1209	speech	verse	Prospero_Tmp	Poor worm, thou art infected.
The Tempest	3	1	1210	speech	verse	Prospero_Tmp	This visitation shows it.
The Tempest	3	1	1211	speech	verse	Miranda_Tmp	You look wearily.
The Tempest	3	1	1212	speech	verse	Ferdinand_Tmp	No, noble mistress, ’tis fresh morning with me
The Tempest	3	1	1213	speech	verse	Ferdinand_Tmp	When you are by at night. I do beseech you,
The Tempest	3	1	1214	speech	verse	Ferdinand_Tmp	Chiefly that I might set it in my prayers,
The Tempest	3	1	1215	speech	verse	Ferdinand_Tmp	What is your name?
The Tempest	3	1	1216	speech	verse	Miranda_Tmp	Miranda.—O my father,
The Tempest	3	1	1217	speech	verse	Miranda_Tmp	I have broke your hest to say so!
The Tempest	3	1	1218	speech	verse	Ferdinand_Tmp	Admired Miranda!
The Tempest	3	1	1219	speech	verse	Ferdinand_Tmp	Indeed the top of admiration, worth
The Tempest	3	1	1220	speech	verse	Ferdinand_Tmp	What’s dearest to the world! Full many a lady
The Tempest	3	1	1221	speech	verse	Ferdinand_Tmp	I have eyed with best regard, and many a time
The Tempest	3	1	1222	speech	verse	Ferdinand_Tmp	Th’ harmony of their tongues hath into bondage
The Tempest	3	1	1223	speech	verse	Ferdinand_Tmp	Brought my too diligent ear. For several virtues
The Tempest	3	1	1224	speech	verse	Ferdinand_Tmp	Have I liked several women, never any
The Tempest	3	1	1225	speech	verse	Ferdinand_Tmp	With so full soul but some defect in her
The Tempest	3	1	1226	speech	verse	Ferdinand_Tmp	Did quarrel with the noblest grace she owed,
The Tempest	3	1	1227	speech	verse	Ferdinand_Tmp	And put it to the foil. But you, O you,
The Tempest	3	1	1228	speech	verse	Ferdinand_Tmp	So perfect and so peerless, are created
The Tempest	3	1	1229	speech	verse	Ferdinand_Tmp	Of every creature’s best.
The Tempest	3	1	1230	speech	verse	Miranda_Tmp	I do not know
The Tempest	3	1	1231	speech	verse	Miranda_Tmp	One of my sex, no woman’s face remember,
The Tempest	3	1	1232	speech	verse	Miranda_Tmp	Save, from my glass, mine own. Nor have I seen
The Tempest	3	1	1233	speech	verse	Miranda_Tmp	More that I may call men than you, good friend,
The Tempest	3	1	1234	speech	verse	Miranda_Tmp	And my dear father. How features are abroad
The Tempest	3	1	1235	speech	verse	Miranda_Tmp	I am skilless of, but by my modesty,
The Tempest	3	1	1236	speech	verse	Miranda_Tmp	The jewel in my dower, I would not wish
The Tempest	3	1	1237	speech	verse	Miranda_Tmp	Any companion in the world but you,
The Tempest	3	1	1238	speech	verse	Miranda_Tmp	Nor can imagination form a shape
The Tempest	3	1	1239	speech	verse	Miranda_Tmp	Besides yourself to like of. But I prattle
The Tempest	3	1	1240	speech	verse	Miranda_Tmp	Something too wildly, and my father’s precepts
The Tempest	3	1	1241	speech	verse	Miranda_Tmp	I therein do forget.
The Tempest	3	1	1242	speech	verse	Ferdinand_Tmp	I am in my condition
The Tempest	3	1	1243	speech	verse	Ferdinand_Tmp	A prince, Miranda; I do think a king—
The Tempest	3	1	1244	speech	verse	Ferdinand_Tmp	I would, not so!—and would no more endure
The Tempest	3	1	1245	speech	verse	Ferdinand_Tmp	This wooden slavery than to suffer
The Tempest	3	1	1246	speech	verse	Ferdinand_Tmp	The flesh-fly blow my mouth. Hear my soul speak:
The Tempest	3	1	1247	speech	verse	Ferdinand_Tmp	The very instant that I saw you did
The Tempest	3	1	1248	speech	verse	Ferdinand_Tmp	My heart fly to your service, there resides
The Tempest	3	1	1249	speech	verse	Ferdinand_Tmp	To make me slave to it, and for your sake
The Tempest	3	1	1250	speech	verse	Ferdinand_Tmp	Am I this patient log-man.
The Tempest	3	1	1251	speech	verse	Miranda_Tmp	Do you love me?
The Tempest	3	1	1252	speech	verse	Ferdinand_Tmp	O heaven, O Earth, bear witness to this sound,
The Tempest	3	1	1253	speech	verse	Ferdinand_Tmp	And crown what I profess with kind event
The Tempest	3	1	1254	speech	verse	Ferdinand_Tmp	If I speak true; if hollowly, invert
The Tempest	3	1	1255	speech	verse	Ferdinand_Tmp	What best is boded me to mischief. I,
The Tempest	3	1	1256	speech	verse	Ferdinand_Tmp	Beyond all limit of what else i’ th’ world,
The Tempest	3	1	1257	speech	verse	Ferdinand_Tmp	Do love, prize, honor you.
The Tempest	3	1	1258	speech	verse	Miranda_Tmp	I am a fool
The Tempest	3	1	1259	speech	verse	Miranda_Tmp	To weep at what I am glad of.
The Tempest	3	1	1260	direction	delivery	Prospero_Tmp	, aside
The Tempest	3	1	1261	speech	verse	Prospero_Tmp	Fair encounter
The Tempest	3	1	1262	speech	verse	Prospero_Tmp	Of two most rare affections. Heavens rain grace
The Tempest	3	1	1263	speech	verse	Prospero_Tmp	On that which breeds between ’em!
The Tempest	3	1	1264	speech	verse	Ferdinand_Tmp	Wherefore weep you?
The Tempest	3	1	1265	speech	verse	Miranda_Tmp	At mine unworthiness, that dare not offer
The Tempest	3	1	1266	speech	verse	Miranda_Tmp	What I desire to give, and much less take
The Tempest	3	1	1267	speech	verse	Miranda_Tmp	What I shall die to want. But this is trifling,
The Tempest	3	1	1268	speech	verse	Miranda_Tmp	And all the more it seeks to hide itself,
The Tempest	3	1	1269	speech	verse	Miranda_Tmp	The bigger bulk it shows. Hence, bashful cunning,
The Tempest	3	1	1270	speech	verse	Miranda_Tmp	And prompt me, plain and holy innocence.
The Tempest	3	1	1271	speech	verse	Miranda_Tmp	I am your wife if you will marry me.
The Tempest	3	1	1272	speech	verse	Miranda_Tmp	If not, I’ll die your maid. To be your fellow
The Tempest	3	1	1273	speech	verse	Miranda_Tmp	You may deny me, but I’ll be your servant
The Tempest	3	1	1274	speech	verse	Miranda_Tmp	Whether you will or no.
The Tempest	3	1	1275	speech	verse	Ferdinand_Tmp	My mistress, dearest, and I thus humble ever.
The Tempest	3	1	1276	speech	verse	Miranda_Tmp	My husband, then?
The Tempest	3	1	1277	speech	verse	Ferdinand_Tmp	Ay, with a heart as willing
The Tempest	3	1	1278	speech	verse	Ferdinand_Tmp	As bondage e’er of freedom. Here’s my hand.
The Tempest	3	1	1279	direction	business	Miranda_Tmp	, clasping his hand
The Tempest	3	1	1279	direction	business	Ferdinand_Tmp	, clasping his hand
The Tempest	3	1	1280	speech	verse	Miranda_Tmp	And mine, with my heart in ’t. And now farewell
The Tempest	3	1	1281	speech	verse	Miranda_Tmp	Till half an hour hence.
The Tempest	3	1	1282	speech	verse	Ferdinand_Tmp	A thousand thousand.
The Tempest	3	1	1283	direction	exit	Ferdinand_Tmp	They exit.
The Tempest	3	1	1283	direction	exit	Miranda_Tmp	They exit.
The Tempest	3	1	1284	speech	verse	Prospero_Tmp	So glad of this as they I cannot be,
The Tempest	3	1	1285	speech	verse	Prospero_Tmp	Who are surprised withal; but my rejoicing
The Tempest	3	1	1286	speech	verse	Prospero_Tmp	At nothing can be more. I’ll to my book,
The Tempest	3	1	1287	speech	verse	Prospero_Tmp	For yet ere suppertime must I perform
The Tempest	3	1	1288	speech	verse	Prospero_Tmp	Much business appertaining.
The Tempest	3	1	1289	direction	exit	Prospero_Tmp	He exits.
The Tempest	3	2	1290	direction	entrance	Caliban_Tmp	Enter Caliban, Stephano, and Trinculo.
The Tempest	3	2	1290	direction	entrance	Stephano_Tmp	Enter Caliban, Stephano, and Trinculo.
The Tempest	3	2	1290	direction	entrance	Trinculo_Tmp	Enter Caliban, Stephano, and Trinculo.
The Tempest	3	2	1291	direction	delivery	Stephano_Tmp	, to Trinculo
The Tempest	3	2	1292	speech	prose	Stephano_Tmp	Tell not me. When the butt is out, we will drink water; not a drop before. Therefore bear up and board ’em.—Servant monster, drink to me.
The Tempest	3	2	1293	speech	prose	Trinculo_Tmp	Servant monster? The folly of this island! They say there’s but five upon this isle; we are three of them. If th’ other two be brained like us, the state totters.
The Tempest	3	2	1294	speech	prose	Stephano_Tmp	Drink, servant monster, when I bid thee. Thy eyes are almost set in thy head.
The Tempest	3	2	1295	direction	business	Caliban_Tmp	Caliban drinks.
The Tempest	3	2	1296	speech	prose	Trinculo_Tmp	Where should they be set else? He were a brave monster indeed if they were set in his tail.
The Tempest	3	2	1297	speech	prose	Stephano_Tmp	My man-monster hath drowned his tongue in sack. For my part, the sea cannot drown me. I swam, ere I could recover the shore, five-and-thirty leagues off and on, by this light.—Thou shalt be my lieutenant, monster, or my standard.
The Tempest	3	2	1298	speech	prose	Trinculo_Tmp	Your lieutenant, if you list. He’s no standard.
The Tempest	3	2	1299	speech	prose	Stephano_Tmp	We’ll not run, Monsieur Monster.
The Tempest	3	2	1300	speech	prose	Trinculo_Tmp	Nor go neither. But you’ll lie like dogs, and yet say nothing neither.
The Tempest	3	2	1301	speech	prose	Stephano_Tmp	Mooncalf, speak once in thy life, if thou be’st a good mooncalf.
The Tempest	3	2	1302	speech	prose	Caliban_Tmp	How does thy Honor? Let me lick thy shoe. I’ll not serve him; he is not valiant.
The Tempest	3	2	1303	speech	prose	Trinculo_Tmp	Thou liest, most ignorant monster. I am in case to justle a constable. Why, thou debauched fish, thou! Was there ever man a coward that hath drunk so much sack as I today? Wilt thou tell a monstrous lie, being but half a fish and half a monster?
The Tempest	3	2	1304	speech	prose	Caliban_Tmp	Lo, how he mocks me! Wilt thou let him, my lord?
The Tempest	3	2	1305	speech	prose	Trinculo_Tmp	“Lord,” quoth he? That a monster should be such a natural!
The Tempest	3	2	1306	speech	prose	Caliban_Tmp	Lo, lo again! Bite him to death, I prithee.
The Tempest	3	2	1307	speech	prose	Stephano_Tmp	Trinculo, keep a good tongue in your head. If you prove a mutineer, the next tree. The poor monster’s my subject, and he shall not suffer indignity.
The Tempest	3	2	1308	speech	prose	Caliban_Tmp	I thank my noble lord. Wilt thou be pleased to harken once again to the suit I made to thee?
The Tempest	3	2	1309	speech	prose	Stephano_Tmp	Marry, will I. Kneel and repeat it. I will stand, and so shall Trinculo.
The Tempest	3	2	1310	direction	entrance	Ariel_Tmp	Enter Ariel, invisible.
The Tempest	3	2	1311	direction	business	Caliban_Tmp	, kneeling
The Tempest	3	2	1312	speech	prose	Caliban_Tmp	As I told thee before, I am subject to a tyrant, a sorcerer, that by his cunning hath cheated me of the island.
The Tempest	3	2	1313	direction	delivery	Ariel_Tmp	, in Trinculo’s voice
The Tempest	3	2	1314	speech	prose	Ariel_Tmp	Thou liest.
The Tempest	3	2	1315	direction	delivery	Caliban_Tmp	, to Trinculo
The Tempest	3	2	1316	speech	prose	Caliban_Tmp	Thou liest, thou jesting monkey, thou. I would my valiant master would destroy thee. I do not lie.
The Tempest	3	2	1317	direction	business	Caliban_Tmp	He stands.
The Tempest	3	2	1318	speech	prose	Stephano_Tmp	Trinculo, if you trouble him any more in ’s tale, by this hand, I will supplant some of your teeth.
The Tempest	3	2	1319	speech	prose	Trinculo_Tmp	Why, I said nothing.
The Tempest	3	2	1320	speech	prose	Stephano_Tmp	Mum then, and no more.
The Tempest	3	2	1321	direction	business	Trinculo_Tmp	Trinculo stands aside.
The Tempest	3	2	1322	speech	prose	Stephano_Tmp	Proceed.
The Tempest	3	2	1323	speech	verse	Caliban_Tmp	I say by sorcery he got this isle;
The Tempest	3	2	1324	speech	verse	Caliban_Tmp	From me he got it. If thy Greatness will,
The Tempest	3	2	1325	speech	verse	Caliban_Tmp	Revenge it on him, for I know thou dar’st,
The Tempest	3	2	1326	speech	verse	Caliban_Tmp	But this thing dare not.
The Tempest	3	2	1327	speech	prose	Stephano_Tmp	That’s most certain.
The Tempest	3	2	1328	speech	verse	Caliban_Tmp	Thou shalt be lord of it, and I’ll serve thee.
The Tempest	3	2	1329	speech	prose	Stephano_Tmp	How now shall this be compassed? Canst thou bring me to the party?
The Tempest	3	2	1330	speech	verse	Caliban_Tmp	Yea, yea, my lord. I’ll yield him thee asleep,
The Tempest	3	2	1331	speech	verse	Caliban_Tmp	Where thou mayst knock a nail into his head.
The Tempest	3	2	1332	direction	delivery	Ariel_Tmp	, in Trinculo’s voice
The Tempest	3	2	1333	speech	prose	Ariel_Tmp	Thou liest. Thou canst not.
The Tempest	3	2	1334	speech	verse	Caliban_Tmp	What a pied ninny’s this!—Thou scurvy patch!—
The Tempest	3	2	1335	speech	verse	Caliban_Tmp	I do beseech thy Greatness, give him blows
The Tempest	3	2	1336	speech	verse	Caliban_Tmp	And take his bottle from him. When that’s gone,
The Tempest	3	2	1337	speech	verse	Caliban_Tmp	He shall drink naught but brine, for I’ll not show him
The Tempest	3	2	1338	speech	verse	Caliban_Tmp	Where the quick freshes are.
The Tempest	3	2	1339	speech	prose	Stephano_Tmp	Trinculo, run into no further danger. Interrupt the monster one word further, and by this hand, I’ll turn my mercy out o’ doors and make a stockfish of thee.
The Tempest	3	2	1340	speech	prose	Trinculo_Tmp	Why, what did I? I did nothing. I’ll go farther off.
The Tempest	3	2	1341	speech	prose	Stephano_Tmp	Didst thou not say he lied?
The Tempest	3	2	1342	direction	delivery	Ariel_Tmp	, in Trinculo’s voice
The Tempest	3	2	1343	speech	prose	Ariel_Tmp	Thou liest.
The Tempest	3	2	1344	speech	prose	Stephano_Tmp	Do I so? Take thou that.
The Tempest	3	2	1345	direction	business	Stephano_Tmp	He beats Trinculo.
The Tempest	3	2	1345	direction	business	Trinculo_Tmp	He beats Trinculo.
The Tempest	3	2	1346	speech	prose	Stephano_Tmp	As you like this, give me the lie another time.
The Tempest	3	2	1347	speech	prose	Trinculo_Tmp	I did not give the lie! Out o’ your wits and hearing too? A pox o’ your bottle! This can sack and drinking do. A murrain on your monster, and the devil take your fingers!
The Tempest	3	2	1348	speech	prose	Caliban_Tmp	Ha, ha, ha!
The Tempest	3	2	1349	speech	prose	Stephano_Tmp	Now forward with your tale.
The Tempest	3	2	1350	direction	delivery	Stephano_Tmp	To Trinculo.
The Tempest	3	2	1351	speech	prose	Stephano_Tmp	Prithee, stand further off.
The Tempest	3	2	1352	speech	verse	Caliban_Tmp	Beat him enough. After a little time
The Tempest	3	2	1353	speech	verse	Caliban_Tmp	I’ll beat him too.
The Tempest	3	2	1354	speech	prose	Stephano_Tmp	Stand farther.
The Tempest	3	2	1355	direction	business	Trinculo_Tmp	Trinculo moves farther away.
The Tempest	3	2	1356	speech	prose	Stephano_Tmp	Come, proceed.
The Tempest	3	2	1357	speech	verse	Caliban_Tmp	Why, as I told thee, ’tis a custom with him
The Tempest	3	2	1358	speech	verse	Caliban_Tmp	I’ th’ afternoon to sleep. There thou mayst brain him,
The Tempest	3	2	1359	speech	verse	Caliban_Tmp	Having first seized his books, or with a log
The Tempest	3	2	1360	speech	verse	Caliban_Tmp	Batter his skull, or paunch him with a stake,
The Tempest	3	2	1361	speech	verse	Caliban_Tmp	Or cut his weasand with thy knife. Remember
The Tempest	3	2	1362	speech	verse	Caliban_Tmp	First to possess his books, for without them
The Tempest	3	2	1363	speech	verse	Caliban_Tmp	He’s but a sot, as I am, nor hath not
The Tempest	3	2	1364	speech	verse	Caliban_Tmp	One spirit to command. They all do hate him
The Tempest	3	2	1365	speech	verse	Caliban_Tmp	As rootedly as I. Burn but his books.
The Tempest	3	2	1366	speech	verse	Caliban_Tmp	He has brave utensils—for so he calls them—
The Tempest	3	2	1367	speech	verse	Caliban_Tmp	Which, when he has a house, he’ll deck withal.
The Tempest	3	2	1368	speech	verse	Caliban_Tmp	And that most deeply to consider is
The Tempest	3	2	1369	speech	verse	Caliban_Tmp	The beauty of his daughter. He himself
The Tempest	3	2	1370	speech	verse	Caliban_Tmp	Calls her a nonpareil. I never saw a woman
The Tempest	3	2	1371	speech	verse	Caliban_Tmp	But only Sycorax my dam and she;
The Tempest	3	2	1372	speech	verse	Caliban_Tmp	But she as far surpasseth Sycorax
The Tempest	3	2	1373	speech	verse	Caliban_Tmp	As great’st does least.
The Tempest	3	2	1374	speech	verse	Stephano_Tmp	Is it so brave a lass?
The Tempest	3	2	1375	speech	verse	Caliban_Tmp	Ay, lord, she will become thy bed, I warrant,
The Tempest	3	2	1376	speech	verse	Caliban_Tmp	And bring thee forth brave brood.
The Tempest	3	2	1377	speech	prose	Stephano_Tmp	Monster, I will kill this man. His daughter and I will be king and queen—save our Graces!— and Trinculo and thyself shall be viceroys.—Dost thou like the plot, Trinculo?
The Tempest	3	2	1378	speech	prose	Trinculo_Tmp	Excellent.
The Tempest	3	2	1379	speech	prose	Stephano_Tmp	Give me thy hand. I am sorry I beat thee. But while thou liv’st, keep a good tongue in thy head.
The Tempest	3	2	1380	speech	verse	Caliban_Tmp	Within this half hour will he be asleep.
The Tempest	3	2	1381	speech	verse	Caliban_Tmp	Wilt thou destroy him then?
The Tempest	3	2	1382	speech	verse	Stephano_Tmp	Ay, on mine honor.
The Tempest	3	2	1383	direction	delivery	Ariel_Tmp	, aside
The Tempest	3	2	1384	speech	verse	Ariel_Tmp	This will I tell my master.
The Tempest	3	2	1385	speech	verse	Caliban_Tmp	Thou mak’st me merry. I am full of pleasure.
The Tempest	3	2	1386	speech	verse	Caliban_Tmp	Let us be jocund. Will you troll the catch
The Tempest	3	2	1387	speech	verse	Caliban_Tmp	You taught me but whilere?
The Tempest	3	2	1388	speech	prose	Stephano_Tmp	At thy request, monster, I will do reason, any reason.—Come on, Trinculo, let us sing.
The Tempest	3	2	1389	direction	delivery	Stephano_Tmp	Sings.
The Tempest	3	2	1390	speech	verse	Stephano_Tmp	Flout ’em and cout ’em
The Tempest	3	2	1391	speech	verse	Stephano_Tmp	And scout ’em and flout ’em!
The Tempest	3	2	1392	speech	verse	Stephano_Tmp	Thought is free.
The Tempest	3	2	1393	speech	prose	Caliban_Tmp	That’s not the tune.
The Tempest	3	2	1394	direction	sound		Ariel plays the tune on a tabor and pipe.
The Tempest	3	2	1395	speech	prose	Stephano_Tmp	What is this same?
The Tempest	3	2	1396	speech	prose	Trinculo_Tmp	This is the tune of our catch played by the picture of Nobody.
The Tempest	3	2	1397	direction	delivery	Stephano_Tmp	, to the invisible musician
The Tempest	3	2	1398	speech	prose	Stephano_Tmp	If thou be’st a man, show thyself in thy likeness. If thou be’st a devil, take ’t as thou list.
The Tempest	3	2	1399	speech	prose	Trinculo_Tmp	O, forgive me my sins!
The Tempest	3	2	1400	speech	prose	Stephano_Tmp	He that dies pays all debts.—I defy thee!— Mercy upon us!
The Tempest	3	2	1401	speech	prose	Caliban_Tmp	Art thou afeard?
The Tempest	3	2	1402	speech	prose	Stephano_Tmp	No, monster, not I.
The Tempest	3	2	1403	speech	verse	Caliban_Tmp	Be not afeard. The isle is full of noises,
The Tempest	3	2	1404	speech	verse	Caliban_Tmp	Sounds and sweet airs that give delight and hurt not.
The Tempest	3	2	1405	speech	verse	Caliban_Tmp	Sometimes a thousand twangling instruments
The Tempest	3	2	1406	speech	verse	Caliban_Tmp	Will hum about mine ears, and sometimes voices
The Tempest	3	2	1407	speech	verse	Caliban_Tmp	That, if I then had waked after long sleep,
The Tempest	3	2	1408	speech	verse	Caliban_Tmp	Will make me sleep again; and then, in dreaming,
The Tempest	3	2	1409	speech	verse	Caliban_Tmp	The clouds methought would open, and show riches
The Tempest	3	2	1410	speech	verse	Caliban_Tmp	Ready to drop upon me, that when I waked
The Tempest	3	2	1411	speech	verse	Caliban_Tmp	I cried to dream again.
The Tempest	3	2	1412	speech	prose	Stephano_Tmp	This will prove a brave kingdom to me, where I shall have my music for nothing.
The Tempest	3	2	1413	speech	prose	Caliban_Tmp	When Prospero is destroyed.
The Tempest	3	2	1414	speech	prose	Stephano_Tmp	That shall be by and by. I remember the story.
The Tempest	3	2	1415	speech	prose	Trinculo_Tmp	The sound is going away. Let’s follow it, and after do our work.
The Tempest	3	2	1416	speech	prose	Stephano_Tmp	Lead, monster. We’ll follow.—I would I could see this taborer. He lays it on. Wilt come?
The Tempest	3	2	1417	speech	prose	Trinculo_Tmp	I’ll follow, Stephano.
The Tempest	3	2	1418	direction	exit	Ariel_Tmp	They exit.
